{
  "$schema": "https://json-schema.org/draft/2020-12/schema",
  "$id": "https://raw.githubusercontent.com/Dashtid/subvectors/main/vectors/schema/vector-suite.schema.json",
  "title": "OIDC CI/CD trust-condition conformance vector suite",
  "description": "A file of test vectors, each answering: does subject S satisfy trust condition C, and is C safe?",
  "type": "object",
  "additionalProperties": false,
  "required": [
    "suite",
    "version",
    "vectors"
  ],
  "properties": {
    "suite": {
      "type": "string",
      "description": "Stable identifier for this suite file, e.g. 'github-aws'."
    },
    "version": {
      "type": "string",
      "description": "Suite revision, bumped when vectors change."
    },
    "description": {
      "type": "string"
    },
    "vectors": {
      "type": "array",
      "minItems": 1,
      "items": {
        "$ref": "#/$defs/vector"
      }
    }
  },
  "$defs": {
    "vector": {
      "type": "object",
      "additionalProperties": false,
      "required": [
        "id",
        "issuer",
        "subject",
        "condition",
        "expect",
        "status",
        "sources"
      ],
      "properties": {
        "id": {
          "type": "string",
          "pattern": "^[a-z0-9]+(-[a-z0-9]+)*$",
          "description": "Kebab-case, unique across the whole corpus."
        },
        "description": {
          "type": "string"
        },
        "issuer": {
          "enum": [
            "github",
            "gitlab",
            "bitbucket",
            "circleci",
            "terraform-cloud"
          ],
          "description": "Which CI system minted the subject."
        },
        "subject": {
          "type": "string",
          "minLength": 1,
          "description": "A concrete OIDC token subject claim value (no wildcards)."
        },
        "claims": {
          "type": "object",
          "minProperties": 1,
          "propertyNames": {
            "pattern": "^[a-z0-9](?:[a-z0-9._/-]*[a-z0-9])?$"
          },
          "additionalProperties": {
            "type": "string"
          },
          "description": "The full OIDC token claim set the condition is evaluated against (gcp-cel addresses it as assertion.<name>; an AWS condition with claim != 'sub', e.g. 'aud', resolves its value here). Claim names allow namespaced OIDC forms with dots/slashes/hyphens (e.g. CircleCI's 'oidc.circleci.com/project-id'), not just bare identifiers. Optional: vectors whose condition targets 'sub' may omit it and match on 'subject' alone. When present, claims.sub MUST equal 'subject'."
        },
        "condition": {
          "$ref": "#/$defs/condition"
        },
        "expect": {
          "enum": [
            "match",
            "no-match"
          ],
          "description": "Whether the subject satisfies the condition."
        },
        "judgment": {
          "$ref": "#/$defs/judgment"
        },
        "status": {
          "enum": [
            "documented",
            "observed"
          ],
          "description": "'documented' = derived from cited docs; 'observed' = confirmed against a real issuer/cloud."
        },
        "sources": {
          "type": "array",
          "minItems": 1,
          "items": {
            "type": "string",
            "format": "uri"
          },
          "description": "Primary-source URLs. Every vector is cited; none ship on vibes."
        },
        "observation": {
          "$ref": "#/$defs/observation"
        }
      },
      "allOf": [
        {
          "if": {
            "properties": {
              "status": {
                "const": "observed"
              }
            },
            "required": [
              "status"
            ]
          },
          "then": {
            "required": [
              "observation"
            ]
          },
          "else": {
            "properties": {
              "observation": false
            }
          }
        }
      ]
    },
    "condition": {
      "type": "object",
      "additionalProperties": false,
      "required": [
        "consumer"
      ],
      "properties": {
        "consumer": {
          "enum": [
            "aws-stringlike",
            "aws-stringequals",
            "aws-all",
            "azure-fic-exact",
            "azure-fic-flexible",
            "gcp-cel"
          ],
          "description": "Which cloud consumer's matching semantics apply. 'aws-all' models a full IAM Condition block: an AND of AWS string sub-conditions in 'of'."
        },
        "claim": {
          "type": "string",
          "pattern": "^[a-z0-9](?:[a-z0-9._/-]*[a-z0-9])?$",
          "description": "Token claim the condition targets (default 'sub'), same shape as claims-map keys (namespaced OIDC names like 'oidc.circleci.com/project-id' allowed). When not 'sub', the vector MUST carry a 'claims' object (the targeted claim may be deliberately absent from it to encode absent-key semantics)."
        },
        "qualifier": {
          "enum": [
            "ForAllValues",
            "ForAnyValue"
          ],
          "description": "AWS set-operator qualifier written in front of the operator (ForAllValues:StringLike). It ranges over the values the REQUEST supplies for the context key, NOT over the policy's value list -- the misreading it invites. AWS: 'Do not use condition set operators ForAllValues or ForAnyValue with single-valued context keys. Using condition set operators with single-valued context keys can lead to overly permissive policies.' ForAllValues 'also returns true if there are no context keys in the request'; ForAnyValue returns false when the key does not exist. So on a claim a token may omit, ForAllValues under an Allow fails OPEN. AWS string consumers only."
        },
        "pattern": {
          "oneOf": [
            {
              "type": "string"
            },
            {
              "type": "array",
              "minItems": 2,
              "items": {
                "type": "string"
              }
            }
          ],
          "description": "The admin-written trust rule (may contain wildcards, per consumer). An array models an AWS multi-value condition (one key, several values, logical OR) and is only valid for the aws-* consumers; a single value is written as a plain string."
        },
        "of": {
          "type": "array",
          "minItems": 2,
          "items": {
            "allOf": [
              {
                "$ref": "#/$defs/condition"
              },
              {
                "properties": {
                  "consumer": {
                    "enum": [
                      "aws-stringlike",
                      "aws-stringequals"
                    ]
                  }
                }
              }
            ]
          },
          "description": "aws-all only: the ANDed sub-conditions of one IAM Condition block ('All context keys in a condition element block must resolve to true'). Each entry is an AWS string condition -- operators may differ per entry (StringEquals aud + StringLike sub) and each may use claim targeting and value lists."
        }
      },
      "allOf": [
        {
          "if": {
            "properties": {
              "consumer": {
                "const": "aws-all"
              }
            },
            "required": [
              "consumer"
            ]
          },
          "then": {
            "required": [
              "of"
            ],
            "properties": {
              "pattern": false,
              "claim": false,
              "qualifier": false
            }
          },
          "else": {
            "required": [
              "pattern"
            ],
            "properties": {
              "of": false
            }
          }
        },
        {
          "if": {
            "properties": {
              "consumer": {
                "enum": [
                  "azure-fic-exact",
                  "azure-fic-flexible",
                  "gcp-cel"
                ]
              }
            },
            "required": [
              "consumer"
            ]
          },
          "then": {
            "properties": {
              "pattern": {
                "type": "string"
              }
            }
          }
        },
        {
          "if": {
            "properties": {
              "consumer": {
                "enum": [
                  "gcp-cel",
                  "azure-fic-flexible"
                ]
              }
            },
            "required": [
              "consumer"
            ]
          },
          "then": {
            "properties": {
              "claim": {
                "const": "sub"
              }
            }
          }
        },
        {
          "$comment": "ForAllValues/ForAnyValue are IAM set operators; no other consumer has set semantics.",
          "if": {
            "required": [
              "qualifier"
            ]
          },
          "then": {
            "properties": {
              "consumer": {
                "enum": [
                  "aws-stringlike",
                  "aws-stringequals"
                ]
              }
            }
          }
        }
      ]
    },
    "judgment": {
      "type": "object",
      "additionalProperties": false,
      "required": [
        "grade",
        "reason"
      ],
      "properties": {
        "grade": {
          "enum": [
            "safe",
            "caution",
            "dangerous"
          ],
          "description": "Human-authored safety grade for the condition; never computed by the matcher."
        },
        "reason": {
          "type": "string"
        },
        "patterns": {
          "type": "array",
          "items": {
            "type": "string"
          },
          "description": "Catalog tags for the over-permission pattern(s), e.g. 'wildcard-repo'."
        }
      }
    },
    "observation": {
      "type": "object",
      "additionalProperties": false,
      "required": [
        "method",
        "date",
        "evidence"
      ],
      "description": "How this vector's 'expect' was confirmed against a live issuer/cloud. Required when status is 'observed', forbidden otherwise -- an 'observed' vector must carry its proof, not just a stronger label than 'documented'.",
      "properties": {
        "method": {
          "enum": [
            "github-actions-oidc-claims",
            "aws-iam-policy-simulator",
            "aws-sts-assume-role",
            "azure-fic-token-exchange",
            "gcp-wif-token-exchange",
            "gcp-wif-provider-validation"
          ],
          "description": "How the result was obtained. 'github-actions-oidc-claims' is issuer-side: the claim set of a token a real GitHub Actions job minted, which confirms the subject GitHub produces while the consumer's match of that string stays documented. 'aws-iam-policy-simulator' creates no cloud resources; the exchange/assume methods use a live credential; 'gcp-wif-provider-validation' records whether provider creation accepts or rejects a CEL expression."
        },
        "date": {
          "type": "string",
          "format": "date",
          "description": "ISO date (YYYY-MM-DD) the observation was recorded."
        },
        "evidence": {
          "type": "string",
          "minLength": 1,
          "description": "The exact request (pattern/subject, policy, or CEL) and the verbatim result (allowed/denied, matched/mismatched, or the API error code), enough for a reader to reproduce."
        },
        "tool_version": {
          "type": "string",
          "description": "CLI/API version where it pins the behavior, e.g. 'aws-cli/2.17'."
        },
        "transcript": {
          "type": "string",
          "pattern": "^observations/[0-9]{4}-[0-9]{2}-[0-9]{2}/[A-Za-z0-9._-]+\\.json$",
          "description": "Repo-relative path to the committed raw request/response record for this observation, written by scripts/observe_aws.py. Prose evidence loses detail -- the 2026-08-30 creation probe was recorded without its condition operator and the finding had to be narrowed. A transcript lets a reader audit the claim without an AWS account. Optional so hand-run historical observations stay valid; required in practice for anything the harness produces."
        }
      }
    }
  }
}
